{
	"$schema": "../schemas/sdk-coverage.schema.json",
	"schemaVersion": 2,
	"catalogueSchemaVersion": 5,
	"platformRepository": "https://github.com/mabzadev/superboard",
	"promotionPolicy": "complete-active-set",
	"libraries": [
		{
			"id": "flutter",
			"lifecycle": "active",
			"packageName": "superboard_flutter",
			"candidatePackageName": "superboard_flutter",
			"sourcePath": "sdks/flutter",
			"sourceVersion": "4.0.0",
			"baselineVersion": "2.1.4",
			"baselineRef": "sdk-flutter-v2.1.4",
			"baselineTag": "sdk-flutter-v2.1.4",
			"baselineSha": "1cddb333ff3330fd6ffa507d780821121bd7273a",
			"catalogueStatus": "pending-release",
			"candidateRef": "sdk-flutter-v4.0.0",
			"coverageMode": "dart-candidate-transitive"
		},
		{
			"id": "flutterflow",
			"lifecycle": "active",
			"packageName": "superboard_flutterflow",
			"candidatePackageName": "superboard_flutterflow",
			"sourcePath": "sdks/flutterflow",
			"sourceVersion": "4.0.0",
			"baselineVersion": "2.2.5",
			"baselineRef": "sdk-flutterflow-v2.2.5",
			"baselineTag": "sdk-flutterflow-v2.2.5",
			"baselineSha": "b90e7e0ede12cf6321a7a8d104baf1fd8f564867",
			"catalogueStatus": "pending-release",
			"candidateRef": "sdk-flutterflow-v4.0.0",
			"coverageMode": "dart-candidate-direct"
		},
		{
			"id": "flutterflow-support",
			"lifecycle": "archived",
			"packageName": "superboard_flutterflow_messaging",
			"sourcePath": "sdks/flutterflow_messaging",
			"sourceVersion": "1.3.0",
			"baselineVersion": "1.3.0",
			"baselineRef": "sdk-flutterflow-messaging-v1.3.0",
			"baselineTag": "sdk-flutterflow-messaging-v1.3.0",
			"baselineSha": "e896f8ea91a140419471b02301f0bde48d8d6b13",
			"catalogueStatus": "released",
			"coverageMode": "historical-release"
		},
		{
			"id": "ios",
			"lifecycle": "internal",
			"packageName": "SuperBoard",
			"sourcePath": "sdks/flutter/native/ios",
			"sourceVersion": "1.0.3",
			"baselineVersion": "1.0.3",
			"baselineRef": "1.0.3",
			"baselineTag": "sdk-ios-v1.0.3",
			"baselineSha": "f57894c886956f4043c0c3899c35250548937463",
			"catalogueStatus": "released",
			"coverageMode": "historical-release"
		},
		{
			"id": "android",
			"lifecycle": "internal",
			"packageName": "io.superboard:superboard-android-sdk",
			"sourcePath": "sdks/flutter/native/android/SuperBoard",
			"sourceVersion": "1.0.3",
			"baselineVersion": "1.0.3",
			"baselineRef": "sdk-android-v1.0.3",
			"baselineTag": "sdk-android-v1.0.3",
			"baselineSha": "21549c99fbe65668e0488f0f5ea2fc62219b53c4",
			"catalogueStatus": "released",
			"coverageMode": "historical-release"
		},
		{
			"id": "javascript",
			"lifecycle": "archived",
			"packageName": "@mabzadev/superboard-js-sdk",
			"sourcePath": "sdks/javascript",
			"sourceVersion": "1.0.2",
			"baselineVersion": "1.0.2",
			"baselineRef": "sdk-js-v1.0.2",
			"baselineTag": "sdk-js-v1.0.2",
			"baselineSha": "cd27c193c471cf1b22f72a61f38acdd62f7a1e99",
			"catalogueStatus": "released",
			"coverageMode": "historical-release"
		},
		{
			"id": "react-native",
			"lifecycle": "archived",
			"packageName": "@mabzadev/superboard-react-native-sdk",
			"sourcePath": "sdks/react-native",
			"sourceVersion": "1.0.2",
			"baselineVersion": "1.0.2",
			"baselineRef": "sdk-react-native-v1.0.2",
			"baselineTag": "sdk-react-native-v1.0.2",
			"baselineSha": "969bacf6f5c52d205ffe6da18cb4c47d85dfbaeb",
			"catalogueStatus": "released",
			"coverageMode": "historical-release"
		}
	]
}
